	term	label	source	quality	action
Other infective otitis externa	http://www.ebi.ac.uk/efo/EFO_0009560	otitis externa	OLS API EFO lookup	fuzzy	check if valid
Otitis externa, unspecified	http://www.ebi.ac.uk/efo/EFO_0009560	otitis externa	OLS API EFO lookup	fuzzy	check if valid
Acute otitis externa, noninfective	http://www.ebi.ac.uk/efo/EFO_0009560	otitis externa	OLS API EFO lookup	fuzzy	check if valid
Other otitis externa (chronic)	http://www.ebi.ac.uk/efo/EFO_0009560	otitis externa	OLS API EFO lookup	fuzzy	check if valid
Conductive hearing loss, unspecified	http://purl.obolibrary.org/obo/HP_0000405	Conductive hearing impairment	OLS API EFO lookup	fuzzy	check if valid
Deaf mutism, not elsewhere classified	http://purl.obolibrary.org/obo/HP_0002300	Mutism	OLS API EFO lookup	fuzzy	check if valid
Sudden idiopathic hearing loss	http://purl.obolibrary.org/obo/MONDO_0020677	sudden hearing loss disorder	OLS API EFO lookup	fuzzy	check if valid
Mixed conductive and sensorineural hearing loss	http://purl.obolibrary.org/obo/MONDO_0044001	hearing loss, mixed conductive-sensorineural	EFO OBO	match	
Other specified/unspecified hearing loss	http://www.ebi.ac.uk/efo/EFO_0004238	hearing loss	OLS API EFO lookup	fuzzy	check if valid
Presbycusis	http://purl.obolibrary.org/obo/MONDO_0043765	presbycusis	EFO OBO	match	
Sensorineural hearing loss	http://www.orpha.net/ORDO/Orphanet_383	X-linked mixed deafness with perilymphatic gusher	EFO OBO	match	
Diseases of inner ear	http://www.ebi.ac.uk/efo/EFO_0009672	inner ear disease	OLS API EFO lookup	fuzzy	check if valid
Acute mastoiditis	http://purl.obolibrary.org/obo/HP_0000265	Mastoiditis	OLS API EFO lookup	fuzzy	check if valid
Chronic mastoiditis	http://purl.obolibrary.org/obo/HP_0000265	Mastoiditis	OLS API EFO lookup	fuzzy	check if valid
Suppurative and unspecified otitis media	http://www.ebi.ac.uk/efo/EFO_0007503	Suppurative and unspecified otitis media	Zooma API lookup	match	
Mnire disease					
Adhesive middle ear disease	http://purl.obolibrary.org/obo/MONDO_0003276	middle ear disease	OLS API EFO lookup	fuzzy	check if valid
Diseases of middle ear and mastoid	http://www.ebi.ac.uk/efo/EFO_1000678	cholesteatoma of middle ear	OLS API EFO lookup	fuzzy	check if valid
Noise effects on inner ear	http://www.ebi.ac.uk/efo/EFO_0009672	inner ear disease	OLS API EFO lookup	fuzzy	check if valid
Nonsuppurative otitis media	http://purl.obolibrary.org/obo/MONDO_0001212	non-suppurative otitis media	EFO OBO	match	
Otalgia	http://purl.obolibrary.org/obo/HP_0030766	Ear pain	OLS API EFO lookup	match	
Other disorders of ear					
Other hearing loss	http://www.ebi.ac.uk/efo/EFO_0004238	Other hearing loss	Zooma API lookup	match	
Otitis media, unspecified	http://www.ebi.ac.uk/efo/EFO_0007503	suppurative otitis media	OLS API EFO lookup	fuzzy	check if valid
Otosclerosis	http://www.ebi.ac.uk/efo/EFO_0004213	otosclerosis	EFO OBO	match	
Perichondritis of external ear	http://purl.obolibrary.org/obo/MONDO_0002246	perichondritis of auricle	OLS API EFO lookup	fuzzy	check if valid
Perforation of tympanic membrane	http://www.ebi.ac.uk/efo/EFO_0009472	Perforation of tympanic membrane	Zooma API lookup	match	
Other peripheral vertigo	http://purl.obolibrary.org/obo/MONDO_0004900	peripheral vertigo	OLS API EFO lookup	fuzzy	check if valid
Postprocedural disorders of ear and mastoid process, not elsewhere classified	http://www.ebi.ac.uk/efo/EFO_1000678	cholesteatoma of middle ear	OLS API EFO lookup	fuzzy	check if valid
Acquired stenosis of external ear canal	http://purl.obolibrary.org/obo/HP_0000402	Stenosis of the external auditory canal	OLS API EFO lookup	fuzzy	check if valid
Acute suppurative otitis media	http://www.ebi.ac.uk/efo/EFO_0007503	suppurative otitis media	OLS API EFO lookup	fuzzy	check if valid
Suppurative otitis media, unspecified	http://www.ebi.ac.uk/efo/EFO_0007503	suppurative otitis media	OLS API EFO lookup	fuzzy	check if valid
Tinnitus	http://purl.obolibrary.org/obo/HP_0000360	tinnitus	OT Zooma Mappings	match	
Disorders of vestibular function (Vertigo)	http://purl.obolibrary.org/obo/MONDO_0002317	central nervous system origin vertigo	OLS API EFO lookup	fuzzy	check if valid
Vertigo of central origin	http://purl.obolibrary.org/obo/MONDO_0002317	central nervous system origin vertigo	EFO OBO	match	
Vestibular neuronitis	http://www.ebi.ac.uk/efo/EFO_0007537	vestibular neuronitis	EFO OBO	match	
Other/unspecified disorders of vestibular function	http://www.ebi.ac.uk/efo/EFO_0000516	glaucoma	OLS API EFO lookup	fuzzy	check if valid
Inguinal hernia, bilateral	http://purl.obolibrary.org/obo/HP_0000023	Inguinal hernia	OLS API EFO lookup	fuzzy	check if valid
Inguinal hernia, unilateralk	http://purl.obolibrary.org/obo/HP_0000023	Inguinal hernia	OLS API EFO lookup	fuzzy	check if valid
Hypotension due to drugs	http://www.ebi.ac.uk/efo/EFO_0005253	postprandial hypotension	OLS API EFO lookup	fuzzy	check if valid
Hypothyroidism (congenital or acquired)	http://www.orpha.net/ORDO/Orphanet_442	Congenital hypothyroidism	OLS API EFO lookup	fuzzy	check if valid
Hypothyroidism, levothyroxin purchases	http://www.ebi.ac.uk/efo/EFO_0004705	hypothyroidism	OLS API EFO lookup	fuzzy	check if valid
Hypothyroidism and >3 levothyroxin purchases					
Hypothyroidism, drug reimbursement	http://www.ebi.ac.uk/efo/EFO_0004705	hypothyroidism	OLS API EFO lookup	fuzzy	check if valid
Atrial fibrillation and flutter	http://www.ebi.ac.uk/efo/EFO_0000275	Atrial fibrillation and flutter	Zooma API lookup	match	
Atrial fibrillation and flutter (no controls excluded)	http://www.ebi.ac.uk/efo/EFO_0003911	atrial flutter	OLS API EFO lookup	fuzzy	check if valid
Atrial fibrillation and flutter with reimbursement	http://www.ebi.ac.uk/efo/EFO_0003911	atrial flutter	OLS API EFO lookup	fuzzy	check if valid
Endovascular or surgical operations to intracerebral aneurysms	http://www.ebi.ac.uk/efo/EFO_0005669	intracerebral hemorrhage	OLS API EFO lookup	fuzzy	check if valid
Cerebral aneurysm, nonruptured	http://www.orpha.net/ORDO/Orphanet_231160	Familial cerebral saccular aneurysm	OLS API EFO lookup	fuzzy	check if valid
Cerebral aneurysm, nonruptured (no controls excluded)	http://www.ebi.ac.uk/efo/EFO_0003870	brain aneurysm	OLS API EFO lookup	fuzzy	check if valid
Endovascular or surgical operations to intracerebral aneurysms (no controls excluded)	http://www.ebi.ac.uk/efo/EFO_0005669	intracerebral hemorrhage	OLS API EFO lookup	fuzzy	check if valid
Angina pectoris	http://www.ebi.ac.uk/efo/EFO_0003913	angina pectoris	EFO OBO	match	
Angina pectoris (no controls excluded)	http://www.ebi.ac.uk/efo/EFO_0003913	angina pectoris	OLS API EFO lookup	fuzzy	check if valid
Coronary angiopasty	http://www.ebi.ac.uk/efo/EFO_1000883	coronary thrombosis	OLS API EFO lookup	fuzzy	check if valid
Coronary angiopasty (no controls excluded)	http://www.ebi.ac.uk/efo/EFO_1000883	coronary thrombosis	OLS API EFO lookup	fuzzy	check if valid
Aortic aneurysm	http://www.ebi.ac.uk/efo/EFO_0001666	aortic aneurysm	EFO OBO	match	
Aortic aneurysm (no controls excluded)	http://www.ebi.ac.uk/efo/EFO_0001666	aortic aneurysm	OLS API EFO lookup	fuzzy	check if valid
Dissection of aorta					
Dissection of aorta (no controls excluded)					
Arterial embolism and thrombosis	http://www.ebi.ac.uk/efo/EFO_0004286	Arterial embolism and thrombosis	Zooma API lookup	match	
Arterial embolism and thrombosis of lower extremity artery	http://www.ebi.ac.uk/efo/EFO_1001150	renal artery obstruction	OLS API EFO lookup	fuzzy	check if valid
Arterial embolism and thrombosis of lower extremity artery (no controls excluded)	http://www.ebi.ac.uk/efo/EFO_1001150	renal artery obstruction	OLS API EFO lookup	fuzzy	check if valid
Other arterial embolism and thrombosis	http://www.ebi.ac.uk/efo/EFO_1001150	renal artery obstruction	OLS API EFO lookup	fuzzy	check if valid
Other arterial embolism and thrombosis (no controls excluded)	http://www.ebi.ac.uk/efo/EFO_1001150	renal artery obstruction	OLS API EFO lookup	fuzzy	check if valid
Arterial embolism and thrombosis (no controls excluded)	http://www.ebi.ac.uk/efo/EFO_1001150	renal artery obstruction	OLS API EFO lookup	fuzzy	check if valid
Other diseases of arteries and capillaries	http://www.ebi.ac.uk/efo/EFO_1000041	nephrosclerosis	OLS API EFO lookup	fuzzy	check if valid
Other diseases of arteries and capillaries (no controls excluded)	http://www.ebi.ac.uk/efo/EFO_1000041	nephrosclerosis	OLS API EFO lookup	fuzzy	check if valid
Atherosclerosis, excluding cerebral, coronary and PAD					
Atherosclerosis, excluding cerebral, coronary and PAD (no controls excluded)					
AV-block	http://purl.obolibrary.org/obo/MONDO_0000465	atrioventricular block (disease)	OLS API EFO lookup	fuzzy	check if valid
AV-block (no controls excluded)	http://purl.obolibrary.org/obo/MONDO_0000465	atrioventricular block (disease)	OLS API EFO lookup	fuzzy	check if valid
Coronary artery bypass grafting					
Coronary artery bypass grafting (no controls excluded)					
Cardiac arrest	http://www.ebi.ac.uk/efo/EFO_0009492	cardiac arrest	EFO OBO	match	
Cardiac arrest (no controls excluded)	http://www.ebi.ac.uk/efo/EFO_0009492	cardiac arrest	OLS API EFO lookup	fuzzy	check if valid
Cardiomyopathies, Primary/intrinsic	http://www.ebi.ac.uk/efo/EFO_0000318	cardiomyopathy	OLS API EFO lookup	fuzzy	check if valid
Cardiomyopathies, Primary/intrinsic (no controls excluded)	http://www.ebi.ac.uk/efo/EFO_0000318	cardiomyopathy	OLS API EFO lookup	fuzzy	check if valid
Cardiomyopathies, Secondary/extrinsic	http://www.ebi.ac.uk/efo/EFO_0000318	cardiomyopathy	OLS API EFO lookup	fuzzy	check if valid
Cardiomyopathies, Secondary/extrinsic (no controls excluded)	http://www.ebi.ac.uk/efo/EFO_0000318	cardiomyopathy	OLS API EFO lookup	fuzzy	check if valid
Cardiomyopathy	http://www.ebi.ac.uk/efo/EFO_0000318	cardiomyopathy	EFO OBO	match	
Cardiomyopathy, Hypertrophic obstructive	http://www.ebi.ac.uk/efo/EFO_0000538	hypertrophic cardiomyopathy	OLS API EFO lookup	match	
Cardiomyopathy, Hypertrophic obstructive (no controls excluded)	http://www.ebi.ac.uk/efo/EFO_0000538	hypertrophic cardiomyopathy	OLS API EFO lookup	fuzzy	check if valid
Cardiomyopathy, other and unspecified	http://www.ebi.ac.uk/efo/EFO_0009734	unspecified juvenile idiopathic arthritis	OLS API EFO lookup	fuzzy	check if valid
Cardiomyopathy, other and unspecified (no controls excluded)	http://www.ebi.ac.uk/efo/EFO_0009734	unspecified juvenile idiopathic arthritis	OLS API EFO lookup	fuzzy	check if valid
Cardiomyopathy (no controls excluded)	http://www.ebi.ac.uk/efo/EFO_1001458	diabetic cardiomyopathy	OLS API EFO lookup	fuzzy	check if valid
Cerebral atherosclerosis	http://www.ebi.ac.uk/efo/EFO_1000860	cerebral atherosclerosis	EFO OBO	match	
Cerebral atherosclerosis (no controls excluded)	http://www.ebi.ac.uk/efo/EFO_1000860	cerebral atherosclerosis	OLS API EFO lookup	fuzzy	check if valid
Other specified cerebrovascular diseases, other cerebrovascular disorders in diseases classified elsewhere	http://www.ebi.ac.uk/efo/EFO_0003763	cerebrovascular disorder	OLS API EFO lookup	fuzzy	check if valid
Other specified cerebrovascular diseases, other cerebrovascular disorders in diseases classified elsewhere (no controls excluded)	http://www.ebi.ac.uk/efo/EFO_0003763	cerebrovascular disorder	OLS API EFO lookup	fuzzy	check if valid
Cerebrovascular diseases	http://www.ebi.ac.uk/efo/EFO_0003763	cerebrovascular disorder	OLS API EFO lookup	fuzzy	check if valid
Major coronary heart disease event	http://www.ebi.ac.uk/efo/EFO_0001645	coronary artery disease	OLS API EFO lookup	fuzzy	check if valid
Conduction disorders	http://www.ebi.ac.uk/efo/EFO_0009692	voice disorders	OLS API EFO lookup	fuzzy	check if valid
Conduction disorders (no controls excluded)	http://www.ebi.ac.uk/efo/EFO_0009692	voice disorders	OLS API EFO lookup	fuzzy	check if valid
Coronary atherosclerosis	http://purl.obolibrary.org/obo/MONDO_0021661	coronary atherosclerosis	EFO OBO	match	
Coronary atherosclerosis (no controls excluded)	http://purl.obolibrary.org/obo/MONDO_0021661	coronary atherosclerosis	OLS API EFO lookup	fuzzy	check if valid
Cardiovascular diseases					
Hard cardiovascular diseases					
Dissection of cerebral arteries, nonruptured					
Dissection of cerebral arteries, nonruptured (no controls excluded)					
Diseases of veins, lymphatic vessels and lymph nodes, not elsewhere classified					
Diseases of arteries, arterioles and capillaries					
DVT of lower extremities and pulmonary embolism	http://www.orpha.net/ORDO/Orphanet_221043	Hereditary sclerosing poikiloderma with tendon and pulmonary involvement	OLS API EFO lookup	fuzzy	check if valid
Endocarditis	http://www.ebi.ac.uk/efo/EFO_0000465	endocarditis	EFO OBO	match	
Endocarditis (no controls excluded)	http://www.ebi.ac.uk/efo/EFO_0000465	endocarditis	OLS API EFO lookup	fuzzy	check if valid
Dronedarone medication	http://www.ebi.ac.uk/efo/EFO_0006344	medication adherence behavior	OLS API EFO lookup	fuzzy	check if valid
Dronedarone medication (no controls excluded)	http://www.ebi.ac.uk/efo/EFO_0006344	medication adherence behavior	OLS API EFO lookup	fuzzy	check if valid
Heart failure,strict	http://www.ebi.ac.uk/efo/EFO_0003144	heart failure	OLS API EFO lookup	fuzzy	check if valid
All-cause Heart Failure	http://www.ebi.ac.uk/efo/EFO_0003144	heart failure	OLS API EFO lookup	fuzzy	check if valid
Heart failure and antihypertensive medication					
Heart failure and hypertrophic cardiomyopathy	http://www.orpha.net/ORDO/Orphanet_314637	Mitochondrial hypertrophic cardiomyopathy with lactic acidosis due to MTO1 deficiency	OLS API EFO lookup	fuzzy	check if valid
Heart failure and bmi 25plus					
Heart failure,strict (no controls excluded)	http://www.ebi.ac.uk/efo/EFO_0003144	heart failure	OLS API EFO lookup	fuzzy	check if valid
Heart failure, not strict	http://www.ebi.ac.uk/efo/EFO_0003144	heart failure	OLS API EFO lookup	fuzzy	check if valid
Hypertensive diseases	http://www.ebi.ac.uk/efo/EFO_1000977	hypertensive retinopathy	OLS API EFO lookup	fuzzy	check if valid
Hypertrophic cardiomyopathy	http://www.ebi.ac.uk/efo/EFO_0000538	hypertrophic cardiomyopathy	EFO OBO	match	
Hypotension	http://www.ebi.ac.uk/efo/EFO_0005251	hypotension	EFO OBO	match	
Hypotension (no controls excluded)	http://www.ebi.ac.uk/efo/EFO_0005251	hypotension	OLS API EFO lookup	fuzzy	check if valid
Hypertension	http://www.ebi.ac.uk/efo/EFO_0000537	hypertension	EFO OBO	match	
Secondary hypertension	http://www.ebi.ac.uk/efo/EFO_1002034	secondary hypertension	EFO OBO	match	
Secondary hypertension (no controls excluded)	http://www.ebi.ac.uk/efo/EFO_1002034	secondary hypertension	OLS API EFO lookup	fuzzy	check if valid
Hypertension, essential	http://www.ebi.ac.uk/efo/EFO_0000537	hypertension	OLS API EFO lookup	fuzzy	check if valid
Hypertension, essential (no controls excluded)	http://www.ebi.ac.uk/efo/EFO_0000537	hypertension	OLS API EFO lookup	fuzzy	check if valid
Hypertensive Heart Disease	http://purl.obolibrary.org/obo/MONDO_0001302	hypertensive heart disease	EFO OBO	match	
Hypertensive Heart Disease (no controls excluded)	http://purl.obolibrary.org/obo/MONDO_0001302	hypertensive heart disease	OLS API EFO lookup	fuzzy	check if valid
Hypertensive heart and/or renal disease	http://purl.obolibrary.org/obo/MONDO_0024633	hypertensive renal disease	OLS API EFO lookup	fuzzy	check if valid
Hypertensive heart and/or renal disease (no controls excluded)	http://purl.obolibrary.org/obo/MONDO_0024633	hypertensive renal disease	OLS API EFO lookup	fuzzy	check if valid
Hypertension complicating pregnancy, childbirth, and the puerperium	http://www.ebi.ac.uk/efo/EFO_0003917	premature birth	OLS API EFO lookup	fuzzy	check if valid
Hypertension, Pulmonary Arterial	http://www.ebi.ac.uk/efo/EFO_0001361	pulmonary arterial hypertension	OLS API EFO lookup	fuzzy	check if valid
Hypertension, Pulmonary Arterial (no controls excluded)	http://www.ebi.ac.uk/efo/EFO_0001361	pulmonary arterial hypertension	OLS API EFO lookup	fuzzy	check if valid
Hypertensive Renal Disease	http://purl.obolibrary.org/obo/MONDO_0024633	hypertensive renal disease	EFO OBO	match	
Hypertensive Renal Disease (no controls excluded)	http://purl.obolibrary.org/obo/MONDO_0024633	hypertensive renal disease	OLS API EFO lookup	fuzzy	check if valid
Hypertension (no controls excluded)	http://www.ebi.ac.uk/efo/EFO_0000537	hypertension	OLS API EFO lookup	fuzzy	check if valid
Intracerebral haemmorrhage	http://www.ebi.ac.uk/efo/EFO_0005669	intracerebral hemorrhage	OLS API EFO lookup	fuzzy	check if valid
Intracerebral haemmorrhage (no controls excluded)	http://www.ebi.ac.uk/efo/EFO_0005669	intracerebral hemorrhage	OLS API EFO lookup	fuzzy	check if valid
Ischaemic heart disease, wide definition	http://www.ebi.ac.uk/efo/EFO_1001339	Heart neoplasm	OLS API EFO lookup	fuzzy	check if valid
Nontraumatic intracranial haemmorrhage	http://www.ebi.ac.uk/efo/EFO_1000993	intracranial hypotension	OLS API EFO lookup	fuzzy	check if valid
Nontraumatic intracranial haemmorrhage (no controls excluded)	http://www.ebi.ac.uk/efo/EFO_1000993	intracranial hypotension	OLS API EFO lookup	fuzzy	check if valid
Ischemic heart diseases	http://www.ebi.ac.uk/efo/EFO_1001375	Myocardial Ischemia	EFO OBO	match	
Death due to cardiac causes	http://www.ebi.ac.uk/efo/EFO_0004278	sudden cardiac arrest	OLS API EFO lookup	fuzzy	check if valid
Left bundle-branch block	http://purl.obolibrary.org/obo/HP_0011713	Left bundle branch block	OLS API EFO lookup	fuzzy	check if valid
Left bundle-branch block (no controls excluded)	http://purl.obolibrary.org/obo/HP_0011713	Left bundle branch block	OLS API EFO lookup	fuzzy	check if valid
Nonspesific lymphadenitis	http://purl.obolibrary.org/obo/HP_0002840	Lymphadenitis	OLS API EFO lookup	fuzzy	check if valid
Nonspesific lymphadenitis (no controls excluded)	http://purl.obolibrary.org/obo/HP_0002840	Lymphadenitis	OLS API EFO lookup	fuzzy	check if valid
Other noninfective disordersof lymphatic vessels and lymph nodes					
Other noninfective disordersof lymphatic vessels and lymph nodes (no controls excluded)					
Myocardial infarction	http://www.ebi.ac.uk/efo/EFO_0000612	myocardial infarction	EFO OBO	match	
Complications following myocardial infarction	http://www.ebi.ac.uk/efo/EFO_0000612	myocardial infarction	OLS API EFO lookup	fuzzy	check if valid
Complications following myocardial infarction (no controls excluded)	http://www.ebi.ac.uk/efo/EFO_0000612	myocardial infarction	OLS API EFO lookup	fuzzy	check if valid
Myocardial infarction (no controls excluded)	http://www.ebi.ac.uk/efo/EFO_0000612	myocardial infarction	OLS API EFO lookup	fuzzy	check if valid
Myocardial infarction, strict	http://www.ebi.ac.uk/efo/EFO_0000612	myocardial infarction	OLS API EFO lookup	fuzzy	check if valid
Myocardial infarction, strict (no controls excluded)	http://www.ebi.ac.uk/efo/EFO_0000612	myocardial infarction	OLS API EFO lookup	fuzzy	check if valid
Myocarditis	http://www.ebi.ac.uk/efo/EFO_0009609	myocarditis	EFO OBO	match	
Myocarditis (no controls excluded)	http://www.ebi.ac.uk/efo/EFO_0009609	myocarditis	OLS API EFO lookup	fuzzy	check if valid
Non-ischemic cardiomyopathy	http://www.ebi.ac.uk/efo/EFO_0009881	nonischemic cardiomyopathy	EFO OBO	match	
Nonischemic cardiomyopathy	http://www.ebi.ac.uk/efo/EFO_0009881	nonischemic cardiomyopathy	EFO OBO	match	
Non-rheumatic valve diseases	http://www.ebi.ac.uk/efo/EFO_0007148	aortic valve insufficiency	OLS API EFO lookup	fuzzy	check if valid
Non-rheumatic valve diseases (no controls excluded)	http://www.ebi.ac.uk/efo/EFO_0007148	aortic valve insufficiency	OLS API EFO lookup	fuzzy	check if valid
Other CVD					
Other aneurysm	http://www.ebi.ac.uk/efo/EFO_0009659	Other aneurysm	Zooma API lookup	match	
Other aneurysm (no controls excluded)	http://www.ebi.ac.uk/efo/EFO_0009659	aneurysm	OLS API EFO lookup	fuzzy	check if valid
Other arrhytmias					
Other arrhytmias (no controls excluded)	http://www.ebi.ac.uk/efo/EFO_1000695	erythematosquamous dermatosis	OLS API EFO lookup	fuzzy	check if valid
Other or ill-defined heart diseases					
Other or ill-defined heart diseases (no controls excluded)					
Other intracranial haemorrhages	http://www.ebi.ac.uk/efo/EFO_1000991	intracranial embolism	OLS API EFO lookup	fuzzy	check if valid
Other intracranial haemorrhages (no controls excluded)	http://www.ebi.ac.uk/efo/EFO_1000991	intracranial embolism	OLS API EFO lookup	fuzzy	check if valid
Other other unspecified disorders of the circulatory system					
Other other unspecified disorders of the circulatory system (no controls excluded)					
Other peripheral vascular diseases	http://www.ebi.ac.uk/efo/EFO_0003875	Other peripheral vascular diseases	Zooma API lookup	match	
Other peripheral vascular diseases (no controls excluded)	http://www.ebi.ac.uk/efo/EFO_0003875	peripheral vascular disease	OLS API EFO lookup	fuzzy	check if valid
Peripheral artery disease	http://www.ebi.ac.uk/efo/EFO_0004265	peripheral arterial disease	EFO OBO	match	
Peripheral artery disease (no controls excluded)	http://www.ebi.ac.uk/efo/EFO_0004265	peripheral arterial disease	OLS API EFO lookup	fuzzy	check if valid
Paroxysmal tachycardia	http://www.ebi.ac.uk/efo/EFO_0009493	paroxysmal tachycardia	EFO OBO	match	
Paroxysmal tachycardia (no controls excluded)	http://www.ebi.ac.uk/efo/EFO_0009493	paroxysmal tachycardia	OLS API EFO lookup	fuzzy	check if valid
Other diseases of pericardium	http://www.ebi.ac.uk/efo/EFO_0007427	Other diseases of pericardium	Zooma API lookup	match	
Other diseases of pericardium (no controls excluded)					
Pericarditis	http://www.ebi.ac.uk/efo/EFO_0007427	pericarditis	EFO OBO	match	
Pericarditis (no controls excluded)	http://www.ebi.ac.uk/efo/EFO_0007427	pericarditis	OLS API EFO lookup	fuzzy	check if valid
Peripheral artery operations in Hilmo	http://www.ebi.ac.uk/efo/EFO_0004265	peripheral arterial disease	OLS API EFO lookup	fuzzy	check if valid
Peripheral artery operations in Hilmo (no controls excluded)	http://www.ebi.ac.uk/efo/EFO_0004265	peripheral arterial disease	OLS API EFO lookup	fuzzy	check if valid
Phlebitis and thrombophlebitis (not including DVT)	http://www.ebi.ac.uk/efo/EFO_1001395	Phlebitis	OLS API EFO lookup	fuzzy	check if valid
DVT of lower extremities	http://purl.obolibrary.org/obo/HP_0002166	Impaired vibration sensation in the lower limbs	OLS API EFO lookup	fuzzy	check if valid
DVT of lower extremities (no controls excluded)	http://www.ebi.ac.uk/efo/EFO_0007068	ulcer of lower limb	OLS API EFO lookup	fuzzy	check if valid
Phlebitis and thrombophlebitis (not including DVT) (no controls excluded)	http://www.ebi.ac.uk/efo/EFO_1001395	Phlebitis	OLS API EFO lookup	fuzzy	check if valid
Status post-ami	http://www.ebi.ac.uk/efo/EFO_0005514	HER2 status	OLS API EFO lookup	fuzzy	check if valid
Status post-ami (no controls excluded)	http://www.ebi.ac.uk/efo/EFO_0005514	HER2 status	OLS API EFO lookup	fuzzy	check if valid
Progressive vascular leukoencephalopathy	http://www.ebi.ac.uk/efo/EFO_0007455	progressive multifocal leukoencephalopathy	OLS API EFO lookup	fuzzy	check if valid
Progressive vascular leukoencephalopathy (no controls excluded)	http://www.ebi.ac.uk/efo/EFO_0007455	progressive multifocal leukoencephalopathy	OLS API EFO lookup	fuzzy	check if valid
Pulmonary embolism	http://www.ebi.ac.uk/efo/EFO_0003827	pulmonary embolism	EFO OBO	match	
Pulmonary embolism (no controls excluded)	http://www.ebi.ac.uk/efo/EFO_0003827	pulmonary embolism	OLS API EFO lookup	fuzzy	check if valid
Pulmonary heart disease, diseases of pulmonary circulation	http://purl.obolibrary.org/obo/MONDO_0001493	chronic pulmonary heart disease	OLS API EFO lookup	fuzzy	check if valid
Other pulmonary heart/vessel disease	http://purl.obolibrary.org/obo/MONDO_0001493	chronic pulmonary heart disease	OLS API EFO lookup	fuzzy	check if valid
Other pulmonary heart/vessel disease (no controls excluded)	http://purl.obolibrary.org/obo/MONDO_0001493	chronic pulmonary heart disease	OLS API EFO lookup	fuzzy	check if valid
Portal vein thrombosis	http://purl.obolibrary.org/obo/HP_0030242	Portal vein thrombosis	Zooma API lookup	match	
Portal vein thrombosis (no controls excluded)	http://purl.obolibrary.org/obo/HP_0030242	Portal vein thrombosis	OLS API EFO lookup	fuzzy	check if valid
Right bundle-branch block	http://purl.obolibrary.org/obo/HP_0011712	Right bundle branch block	OLS API EFO lookup	match	
Right bundle-branch block (no controls excluded)	http://purl.obolibrary.org/obo/HP_0011712	Right bundle branch block	OLS API EFO lookup	fuzzy	check if valid
Emergency coronary revascularization (for ACS) (no controls excluded)	http://www.ebi.ac.uk/efo/EFO_0004723	coronary artery calcification	OLS API EFO lookup	fuzzy	check if valid
Coronary revascularization (ANGIO or CABG)					
Coronary revascularization (ANGIO or CABG) (no controls excluded)					
Rheumatic fever incl heart disease	http://www.ebi.ac.uk/efo/EFO_1001160	rheumatic fever	OLS API EFO lookup	fuzzy	check if valid
Rheumatic fever with heart involvement	http://www.ebi.ac.uk/efo/EFO_1001161	Rheumatic fever with heart involvement	Zooma API lookup	match	
Rheumatic fever with heart involvement (no controls excluded)	http://www.ebi.ac.uk/efo/EFO_1001160	rheumatic fever	OLS API EFO lookup	fuzzy	check if valid
Rheumatic valve diseases	http://www.ebi.ac.uk/efo/EFO_0005755	rheumatic disease	OLS API EFO lookup	fuzzy	check if valid
Rheumatic valve diseases (no controls excluded)	http://www.ebi.ac.uk/efo/EFO_0005755	rheumatic disease	OLS API EFO lookup	fuzzy	check if valid
Subarachnoid haemmorrhage	http://www.ebi.ac.uk/efo/EFO_0000713	subarachnoid hemorrhage	OLS API EFO lookup	fuzzy	check if valid
Aneurysms, operations, SAH					
Aneurysms, operations, SAH (no controls excluded)					
Subarachnoid haemmorrhage (no controls excluded)	http://www.ebi.ac.uk/efo/EFO_0000713	subarachnoid hemorrhage	OLS API EFO lookup	fuzzy	check if valid
Secondary right heart disease	http://www.ebi.ac.uk/efo/EFO_0009193	Pulmonary arterial hypertension associated with another disease	OLS API EFO lookup	fuzzy	check if valid
